filename,notes,authors,licenses,urls
"body/bodies/male/walk.png","see details at https://opengameart.org/content/lpc-character-bases; 'Thick' Male Revised Run/Climb by JaidynReiman (based on ElizaWy's LPC Revised)","bluecarrot16, JaidynReiman, Benjamin K. Smith (BenCreating), Evert, Eliza Wyatt (ElizaWy), TheraHedwig, MuffinElZangano, Durrani, Johannes Sjölund (wulax), Stephen Challener (Redshrike)","OGA-BY 3.0, CC-BY-SA 3.0, GPL 3.0","https://opengameart.org/content/liberated-pixel-cup-lpc-base-assets-sprites-map-tiles, https://opengameart.org/content/lpc-medieval-fantasy-character-sprites, https://opengameart.org/content/lpc-male-jumping-animation-by-durrani, https://opengameart.org/content/lpc-runcycle-and-diagonal-walkcycle, https://opengameart.org/content/lpc-revised-character-basics, https://opengameart.org/content/lpc-be-seated, https://opengameart.org/content/lpc-runcycle-for-male-muscular-and-pregnant-character-bases-with-modular-heads, https://opengameart.org/content/lpc-jump-expanded, https://opengameart.org/content/lpc-character-bases"
"hair/buzzcut/adult/walk.png","","ElizaWy","OGA-BY 3.0","https://opengameart.org/content/lpc-hair"
"torso/clothes/longsleeve/formal/male/walk/white.png","","bluecarrot16, Thane Brimhall (pennomi), laetissima, Stephen Challener (Redshrike), Johannes Sjölund (wulax)","CC-BY-SA 3.0, GPL 3.0","https://opengameart.org/content/lpc-medieval-fantasy-character-sprites, https://opengameart.org/content/lpc-2-characters, https://opengameart.org/content/lpc-gentleman"
"torso/jacket/collared/male/walk/navy.png","","bluecarrot16","CC-BY-SA 3.0, GPL 3.0","https://opengameart.org/content/lpc-gentleman, https://opengameart.org/content/lpc-pirates"
"neck/tie/necktie/male/walk/red.png","Originally by pennomi/laetissima/Makrohn, edited by bluecarrot16, animations and recolors by JaidynReiman","JaidynReiman, bluecarrot16, Thane Brimhall (pennomi), laetissima, Makrohn","CC-BY-SA 3.0, GPL 3.0","https://opengameart.org/content/lpc-2-characters, https://opengameart.org/content/lpc-gentleman"
"legs/formal/male/walk.png","Original pants by Stephen Challener (Redshrike), thrust/shoot bases by Wulax, Formal Pants by Bluecarrot16, climb/jump/run/sit/emotes/revised combat by JaidynReiman","bluecarrot16, JaidynReiman, ElizaWy, Johannes Sjölund (wulax), Stephen Challener (Redshrike)","OGA-BY 3.0, CC-BY-SA 3.0, GPL 3.0","https://opengameart.org/content/liberated-pixel-cup-lpc-base-assets-sprites-map-tiles, https://opengameart.org/content/lpc-medieval-fantasy-character-sprites, https://opengameart.org/content/lpc-2-characters, https://opengameart.org/content/lpc-gentleman, https://opengameart.org/content/lpc-expanded-pants"
"feet/shoes/basic/male/walk.png","original by wulax, edited for v3 base by bluecarrot16, Jump/Sit/Emote/Run/Revised Combat by JaidynReiman","JaidynReiman, bluecarrot16, Johannes Sjölund (wulax)","OGA-BY 3.0, CC-BY-SA 3.0, GPL 3.0","https://opengameart.org/content/lpc-medieval-fantasy-character-sprites, http://opengameart.org/content/lpc-clothing-updates, https://opengameart.org/content/lpc-expanded-socks-shoes"
"head/heads/human/male/walk.png","original head by Redshrike, tweaks by BenCreating, modular version by bluecarrot16","bluecarrot16, Benjamin K. Smith (BenCreating), Stephen Challener (Redshrike)","OGA-BY 3.0, CC-BY-SA 3.0, GPL 3.0","https://opengameart.org/content/liberated-pixel-cup-lpc-base-assets-sprites-map-tiles, https://opengameart.org/content/lpc-character-bases"
